id,times,textString,startTime,endTime,fromSeconds,toSeconds,timeLength
349,"00:29:33,780 --> 00:29:35,040",Too bad!,"00:29:33,780","00:29:35,040",1773.78,1775.04,1.259999999999991
350,"00:29:35,170 --> 00:29:38,128",Th-th-there was a woman!,"00:29:35,170","00:29:38,128",1775.17,1778.128,2.9579999999998563
351,"00:29:38,260 --> 00:29:39,086",- Did she have a mouth like a shark?,"00:29:38,260","00:29:39,086",1778.26,1779.086,0.8260000000000218
352,"00:29:39,106 --> 00:29:39,932",- No!,"00:29:39,106","00:29:39,932",1779.106,1779.932,0.8260000000000218
353,"00:29:39,952 --> 00:29:40,778",No!,"00:29:39,952","00:29:40,778",1779.952,1780.778,0.8260000000000218
354,"00:29:40,798 --> 00:29:41,624",She was...,"00:29:40,798","00:29:41,624",1780.798,1781.624,0.8260000000000218
355,"00:29:41,644 --> 00:29:42,470",I mean...,"00:29:41,644","00:29:42,470",1781.644,1782.47,0.8260000000000218
356,"00:29:42,570 --> 00:29:46,449","Then, was she something like this?","00:29:42,570","00:29:46,449",1782.57,1786.449,3.879000000000133
357,"00:29:47,530 --> 00:29:48,963",It's her!,"00:29:47,530","00:29:48,963",1787.53,1788.963,1.4329999999999927
358,"00:30:02,610 --> 00:30:08,765",Was... she... something... like... this?,"00:30:02,610","00:30:08,765",1802.61,1808.765,6.1550000000002
359,"00:30:15,530 --> 00:30:20,729",The raccoons took endless delight in frightening the humans.,"00:30:15,530","00:30:20,729",1815.53,1820.729,5.199000000000069
360,"00:30:21,450 --> 00:30:24,601","After every big success, they held a celebration.","00:30:21,450","00:30:24,601",1821.45,1824.601,3.1510000000000673
361,"00:30:27,850 --> 00:30:34,482","But Gonta, the one who started it all, showed no signs of recovering from his injuries.","00:30:27,850","00:30:34,482",1827.85,1834.482,6.632000000000062
362,"00:30:34,610 --> 00:30:40,480","His loving wife Otama cared for him tenderly, but she could not soothe his frustration at being out of the fight.","00:30:34,610","00:30:40,480",1834.61,1840.48,5.870000000000118
363,"00:30:40,610 --> 00:30:44,080","Frankly, Gonta thought his raccoon friends were wimps.","00:30:40,610","00:30:44,080",1840.61,1844.08,3.4700000000000273
364,"00:30:44,170 --> 00:30:46,923",Yesterday's News Train was priceless.,"00:30:44,170","00:30:46,923",1844.17,1846.923,2.752999999999929
365,"00:30:47,050 --> 00:30:49,439","That special about ""Tama New Goblin Town.""","00:30:47,050","00:30:49,439",1847.05,1849.439,2.3890000000001237
366,"00:30:49,570 --> 00:30:52,323",They interviewed the cop we scared.,"00:30:49,570","00:30:52,323",1849.57,1852.323,2.7530000000001564
367,"00:30:52,460 --> 00:30:54,238",The other guests laughed in his face.,"00:30:52,460","00:30:54,238",1852.46,1854.238,1.77800000000002
368,"00:30:54,258 --> 00:30:56,036",He was so furious!,"00:30:54,258","00:30:56,036",1854.258,1856.036,1.77800000000002
369,"00:30:56,056 --> 00:30:57,834",I almost died!,"00:30:56,056","00:30:57,834",1856.056,1857.834,1.77800000000002
370,"00:30:57,940 --> 00:30:59,746",Idiot!,"00:30:57,940","00:30:59,746",1857.94,1859.746,1.80600000000004
371,"00:30:59,766 --> 00:31:01,572",So what?,"00:30:59,766","00:31:01,572",1859.766,1861.572,1.8059999999998126
372,"00:31:01,592 --> 00:31:03,398",Are they going to stop the project just because of stuff like that?,"00:31:01,592","00:31:03,398",1861.592,1863.398,1.8059999999998126
373,"00:31:03,530 --> 00:31:05,998","If you're going to shape-shift, do it the way I did!","00:31:03,530","00:31:05,998",1863.53,1865.998,2.4680000000000746
374,"00:31:06,090 --> 00:31:09,321","Cause accidents, and kill them!","00:31:06,090","00:31:09,321",1866.09,1869.321,3.2309999999999945
375,"00:31:09,460 --> 00:31:11,317","- Oh, no!","00:31:09,460","00:31:11,317",1869.46,1871.317,1.856999999999971
376,"00:31:11,337 --> 00:31:13,194",- Gonta!,"00:31:11,337","00:31:13,194",1871.337,1873.194,1.856999999999971
377,"00:31:13,330 --> 00:31:15,924",It was just as Gonta said.,"00:31:13,330","00:31:15,924",1873.33,1875.924,2.594000000000051
378,"00:31:16,010 --> 00:31:17,887",The project didn't stop.,"00:31:16,010","00:31:17,887",1876.01,1877.887,1.8769999999999527
379,"00:31:17,970 --> 00:31:28,240","Rivers were encased in concrete, roads were laid out everywhere, masses of building material flowed in, and the construction of thousands of apartments finally got under way.","00:31:17,970","00:31:28,240",1877.97,1888.24,10.269999999999982
380,"00:31:28,370 --> 00:31:37,998",The strange happenings on the construction sites and in the hills The strange happenings on the construction sites and in the hills received nationwide coverage.,"00:31:28,370","00:31:37,998",1888.37,1897.998,9.628000000000156
381,"00:31:38,090 --> 00:31:41,127",The raccoons became more and more confident of ultimate victory.,"00:31:38,090","00:31:41,127",1898.09,1901.127,3.0370000000000346
382,"00:31:43,130 --> 00:31:45,724","Rock, paper, scissors...","00:31:43,130","00:31:45,724",1903.13,1905.724,2.5939999999998236
383,"00:31:49,530 --> 00:31:51,680","Pom Poko Year 32, autumn.","00:31:49,530","00:31:51,680",1909.53,1911.68,2.150000000000091
384,"00:31:51,810 --> 00:31:58,202","It was time to choose messengers to travel to Sado and Shikoku islands, to seek the help of famous masters in the art of shape-shifting.","00:31:51,810","00:31:58,202",1911.81,1918.202,6.392000000000053
385,"00:31:59,010 --> 00:32:02,002",Tamasaburo of Oni Woods was chosen to go to Shikoku.,"00:31:59,010","00:32:02,002",1919.01,1922.002,2.991999999999962
386,"00:32:03,210 --> 00:32:05,929",Bunta of Mizunomi Marsh was chosen to travel to Sado.,"00:32:03,210","00:32:05,929",1923.21,1925.929,2.719000000000051
387,"00:32:09,010 --> 00:32:19,606","So at the next full moon, the two young raccoons said farewell to their comrades and set out for their destinations in high spirits.","00:32:09,010","00:32:19,606",1929.01,1939.606,10.596000000000004
388,"00:32:32,650 --> 00:32:34,049",What a smell!,"00:32:32,650","00:32:34,049",1952.65,1954.049,1.3989999999998872
389,"00:32:35,730 --> 00:32:41,009",The raccoons continued haunting the construction sites.,"00:32:35,730","00:32:41,009",1955.73,1961.009,5.278999999999996
390,"00:32:47,570 --> 00:32:54,403","They were having so much fun with their shape-shifting, they almost didn't care whether it was effective or not.","00:32:47,570","00:32:54,403",1967.57,1974.403,6.833000000000084
391,"00:33:09,100 --> 00:33:09,859",- Out with the demons!,"00:33:09,100","00:33:09,859",1989.1,1989.859,0.7590000000000146
392,"00:33:09,879 --> 00:33:10,638",- Daddy!,"00:33:09,879","00:33:10,638",1989.879,1990.638,0.7590000000000146
393,"00:33:34,970 --> 00:33:38,804",Will this really drive out the humans?,"00:33:34,970","00:33:38,804",2014.97,2018.804,3.83400000000006
394,"00:33:40,210 --> 00:33:43,964",Won't they see through us one of these days?,"00:33:40,210","00:33:43,964",2020.21,2023.964,3.7539999999999054
395,"00:33:45,290 --> 00:33:48,919","Maybe we should really go after them, like Gonta says.","00:33:45,290","00:33:48,919",2025.29,2028.919,3.629000000000133
396,"00:33:49,970 --> 00:33:54,327",What does it matter if one or two get killed?,"00:33:49,970","00:33:54,327",2029.97,2034.327,4.356999999999971
397,"00:33:55,650 --> 00:34:00,440","""To be, or not to be, that is the question.""","00:33:55,650","00:34:00,440",2035.65,2040.44,4.789999999999964
398,"00:34:10,410 --> 00:34:11,445",Kiyo!,"00:34:10,410","00:34:11,445",2050.41,2051.445,1.0350000000003092
399,"00:34:15,530 --> 00:34:17,202",What are you doing up there?,"00:34:15,530","00:34:17,202",2055.53,2057.202,1.6720000000000255
400,"00:34:21,210 --> 00:34:22,689",Something wrong with your neck?,"00:34:21,210","00:34:22,689",2061.21,2062.689,1.4789999999998145
401,"00:34:24,500 --> 00:34:26,397",I was posing for you.,"00:34:24,500","00:34:26,397",2064.5,2066.397,1.8969999999999345
402,"00:34:26,417 --> 00:34:28,314",I was hoping you'd say I was pretty.,"00:34:26,417","00:34:28,314",2066.417,2068.314,1.8969999999999345
403,"00:34:28,850 --> 00:34:29,760","Oh, sorry.","00:34:28,850","00:34:29,760",2068.85,2069.76,0.9100000000003092
404,"00:34:30,330 --> 00:34:32,605",Now there really is something wrong with my neck.,"00:34:30,330","00:34:32,605",2070.33,2072.605,2.275000000000091
405,"00:34:33,090 --> 00:34:34,000",You looked pretty.,"00:34:33,090","00:34:34,000",2073.09,2074,0.9099999999998545
406,"00:34:34,810 --> 00:34:35,765",It's too late.,"00:34:34,810","00:34:35,765",2074.81,2075.765,0.9549999999999272
407,"00:34:36,290 --> 00:34:37,723",I mean it.,"00:34:36,290","00:34:37,723",2076.29,2077.723,1.4329999999999927
408,"00:34:40,740 --> 00:34:41,914",It's OK.,"00:34:40,740","00:34:41,914",2080.74,2081.914,1.174000000000433
409,"00:34:41,934 --> 00:34:43,108",I just need more practice.,"00:34:41,934","00:34:43,108",2081.934,2083.108,1.1739999999999782
410,"00:34:51,850 --> 00:34:54,523",One day a raccoon from Potamochi Mountain...,"00:34:51,850","00:34:54,523",2091.85,2094.523,2.673000000000229
411,"00:34:56,100 --> 00:34:57,695","Everyone likes that song, don't they?","00:34:56,100","00:34:57,695",2096.1,2097.695,1.5950000000002547
412,"00:34:57,715 --> 00:34:59,310",I kind of like it myself.,"00:34:57,715","00:34:59,310",2097.715,2099.31,1.5949999999998
413,"00:35:00,130 --> 00:35:02,007","Do you know the song, Where Are You From?","00:35:00,130","00:35:02,007",2100.13,2102.007,1.8769999999999527
414,"00:35:02,090 --> 00:35:04,285","Yes, but I can't sing all the lyrics.","00:35:02,090","00:35:04,285",2102.09,2104.285,2.194999999999709
415,"00:35:04,370 --> 00:35:05,439",That song used to be...,"00:35:04,370","00:35:05,439",2104.37,2105.439,1.06899999999996
416,"00:35:05,570 --> 00:35:11,361",There was a raccoon from Senba Along came a hunter...,"00:35:05,570","00:35:11,361",2105.57,2111.361,5.790999999999713
417,"00:35:11,850 --> 00:35:13,886",A hunter shot my grandpa.,"00:35:11,850","00:35:13,886",2111.85,2113.886,2.036000000000058
418,"00:35:15,700 --> 00:35:16,436",I'm sorry.,"00:35:15,700","00:35:16,436",2115.7,2116.436,0.7360000000003311
419,"00:35:16,456 --> 00:35:17,192",I didn't know.,"00:35:16,456","00:35:17,192",2116.456,2117.192,0.7359999999998763
420,"00:35:17,940 --> 00:35:20,337",That's OK.,"00:35:17,940","00:35:20,337",2117.94,2120.337,2.3969999999999345
421,"00:35:20,357 --> 00:35:22,754",But Grandpa wasn't boiled or fried.,"00:35:20,357","00:35:22,754",2120.357,2122.754,2.3969999999999345
422,"00:35:22,890 --> 00:35:26,599",Someone paid a lot for his pelt.,"00:35:22,890","00:35:26,599",2122.89,2126.599,3.7090000000002874
423,"00:35:27,410 --> 00:35:28,763",I really like your fur too.,"00:35:27,410","00:35:28,763",2127.41,2128.763,1.3530000000000655
424,"00:35:29,300 --> 00:35:30,617","Why, that makes me happy.","00:35:29,300","00:35:30,617",2129.3,2130.617,1.3170000000000073
425,"00:35:30,637 --> 00:35:31,954","Coming from you, that is.","00:35:30,637","00:35:31,954",2130.637,2131.954,1.3170000000000073
426,"00:35:35,970 --> 00:35:38,165","So, what were you going to say about that song?","00:35:35,970","00:35:38,165",2135.97,2138.165,2.1950000000001637
427,"00:35:38,250 --> 00:35:42,004",My father used to sing it.,"00:35:38,250","00:35:42,004",2138.25,2142.004,3.7539999999999054
428,"00:35:42,090 --> 00:35:43,569",He was a good ball-bouncer too.,"00:35:42,090","00:35:43,569",2142.09,2143.569,1.4789999999998145
429,"00:35:43,690 --> 00:35:46,284",He must have been a character.,"00:35:43,690","00:35:46,284",2143.69,2146.284,2.594000000000051
430,"00:35:47,090 --> 00:35:52,084","Whenever he got to the end of the song, he always warned us.","00:35:47,090","00:35:52,084",2147.09,2152.084,4.993999999999687
431,"00:35:52,770 --> 00:35:53,919",About what?,"00:35:52,770","00:35:53,919",2152.77,2153.919,1.1489999999998872
432,"00:35:54,050 --> 00:36:01,440","""You kids better remember: Even in a simple ball-bouncing song, you hear about the cruel nature of humans.""","00:35:54,050","00:36:01,440",2154.05,2161.44,7.389999999999873
433,"00:36:01,580 --> 00:36:03,836","""How they hunt us raccoons, kill us and eat us.","00:36:01,580","00:36:03,836",2161.58,2163.836,2.255999999999858
434,"00:36:03,856 --> 00:36:06,112","And don't you forget it!""","00:36:03,856","00:36:06,112",2163.856,2166.112,2.255999999999858
435,"00:36:10,210 --> 00:36:12,360","Say, shall we bounce balls?","00:36:10,210","00:36:12,360",2170.21,2172.36,2.150000000000091
436,"00:36:12,490 --> 00:36:13,843",Are you good at it?,"00:36:12,490","00:36:13,843",2172.49,2173.843,1.3530000000000655
437,"00:36:13,970 --> 00:36:15,722","Yes, I'm pretty good.","00:36:13,970","00:36:15,722",2173.97,2175.722,1.7520000000004075
438,"00:36:20,450 --> 00:36:22,327",Then I better do my best too!,"00:36:20,450","00:36:22,327",2180.45,2182.327,1.8770000000004075
439,"00:36:27,700 --> 00:36:29,091",Where are you from?,"00:36:27,700","00:36:29,091",2187.7,2189.091,1.3910000000000764
440,"00:36:29,111 --> 00:36:30,502",Higo.,"00:36:29,111","00:36:30,502",2189.111,2190.502,1.3910000000000764
441,"00:36:30,522 --> 00:36:31,913",Where's Higo?,"00:36:30,522","00:36:31,913",2190.522,2191.913,1.3910000000000764
442,"00:36:32,060 --> 00:36:33,519",In Kumamoto.,"00:36:32,060","00:36:33,519",2192.06,2193.519,1.4589999999998327
443,"00:36:33,539 --> 00:36:34,998",Where's Kumamoto?,"00:36:33,539","00:36:34,998",2193.539,2194.998,1.4589999999998327
444,"00:36:35,018 --> 00:36:36,477",In Semba.,"00:36:35,018","00:36:36,477",2195.018,2196.477,1.4589999999998327
445,"00:36:36,610 --> 00:36:40,159",There was a raccoon from Semba.,"00:36:36,610","00:36:40,159",2196.61,2200.159,3.548999999999978
446,"00:36:40,290 --> 00:36:41,200",Along came...,"00:36:40,290","00:36:41,200",2200.29,2201.2,0.9099999999998545
447,"00:36:41,330 --> 00:36:45,289","Shokichi, when are you going to do that ""Operation Twin Star"" you talked about?","00:36:41,330","00:36:45,289",2201.33,2205.289,3.9590000000002874
448,"00:36:45,410 --> 00:36:47,799","Oh, I don't really want to do it anymore.","00:36:45,410","00:36:47,799",2205.41,2207.799,2.3890000000001237
449,"00:36:47,930 --> 00:36:50,319",But it was such a good plan.,"00:36:47,930","00:36:50,319",2207.93,2210.319,2.3890000000001237
450,"00:36:51,860 --> 00:36:52,836",Why don't we do it tonight?,"00:36:51,860","00:36:52,836",2211.86,2212.836,0.975999999999658
451,"00:36:52,856 --> 00:36:53,832",Just the two of us.,"00:36:52,856","00:36:53,832",2212.856,2213.832,0.975999999999658
452,"00:36:53,970 --> 00:36:55,847",With you?,"00:36:53,970","00:36:55,847",2213.97,2215.847,1.8770000000004075
453,"00:36:56,330 --> 00:36:57,843",Are you afraid to do it with me?,"00:36:56,330","00:36:57,843",2216.33,2217.843,1.51299999999992
454,"00:36:57,940 --> 00:36:59,558","No, it's not that.","00:36:57,940","00:36:59,558",2217.94,2219.558,1.6179999999999382
455,"00:36:59,578 --> 00:37:01,196",It's just...,"00:36:59,578","00:37:01,196",2219.578,2221.196,1.6179999999999382
456,"00:37:01,620 --> 00:37:03,398",Then let's try.,"00:37:01,620","00:37:03,398",2221.62,2223.398,1.7780000000002474
457,"00:37:03,418 --> 00:37:05,196",I'm sure it will go over really well.,"00:37:03,418","00:37:05,196",2223.418,2225.196,1.7779999999997926
458,"00:37:05,900 --> 00:37:07,757","OK, let's do it!","00:37:05,900","00:37:07,757",2225.9,2227.757,1.856999999999971
459,"00:37:07,777 --> 00:37:09,634","With you as my partner, I bet things will go great.","00:37:07,777","00:37:09,634",2227.777,2229.634,1.856999999999971
460,"00:37:10,570 --> 00:37:11,525",I can't wait!,"00:37:10,570","00:37:11,525",2230.57,2231.525,0.9549999999999272
461,"00:37:21,810 --> 00:37:24,404","Well, well, what adorable little children!","00:37:21,810","00:37:24,404",2241.81,2244.404,2.594000000000051
462,"00:37:25,490 --> 00:37:30,006","We just got back from a trip to the stars, but our home is gone.","00:37:25,490","00:37:30,006",2245.49,2250.006,4.516000000000076
463,"00:37:30,730 --> 00:37:31,958",A trip to the stars?,"00:37:30,730","00:37:31,958",2250.73,2251.958,1.2280000000000655
464,"00:37:32,210 --> 00:37:37,045",From red-eyed Scorpio to the Eagle's wings...,"00:37:32,210","00:37:37,045",2252.21,2257.045,4.835000000000036
465,"00:37:37,170 --> 00:37:41,686",From the coils of the Snake to the brow of the Bear Cub!,"00:37:37,170","00:37:41,686",2257.17,2261.686,4.516000000000076
466,"00:37:41,770 --> 00:37:46,890",We sprinkle the dew and frost as we fly among the stars.,"00:37:41,770","00:37:46,890",2261.77,2266.89,5.119999999999891
467,"00:37:47,010 --> 00:37:49,319",What is this?!,"00:37:47,010","00:37:49,319",2267.01,2269.319,2.3089999999997417
468,"00:37:52,540 --> 00:37:53,817",Our home is gone!,"00:37:52,540","00:37:53,817",2272.54,2273.817,1.2770000000000437
469,"00:37:53,837 --> 00:37:55,114",We're cold!,"00:37:53,837","00:37:55,114",2273.837,2275.114,1.2770000000000437
470,"00:37:55,250 --> 00:37:57,889","Mister, do you know where our home went?","00:37:55,250","00:37:57,889",2275.25,2277.889,2.6390000000001237
471,"00:37:58,900 --> 00:38:00,996",Your home?,"00:37:58,900","00:38:00,996",2278.9,2280.996,2.0960000000000036
472,"00:38:01,016 --> 00:38:03,112",I don't know what you mean.,"00:38:01,016","00:38:03,112",2281.016,2283.112,2.0960000000000036
473,"00:38:03,220 --> 00:38:04,377",Nobody knows!,"00:38:03,220","00:38:04,377",2283.22,2284.377,1.1570000000001528
474,"00:38:04,397 --> 00:38:05,554",Run along now!,"00:38:04,397","00:38:05,554",2284.397,2285.554,1.1570000000001528
475,"00:38:05,660 --> 00:38:06,897",We should call the police.,"00:38:05,660","00:38:06,897",2285.66,2286.897,1.23700000000008
476,"00:38:06,917 --> 00:38:08,154",Someone get the police here!,"00:38:06,917","00:38:08,154",2286.917,2288.154,1.23700000000008
477,"00:38:13,730 --> 00:38:15,049","Hey, what are you kids doing?","00:38:13,730","00:38:15,049",2293.73,2295.049,1.31899999999996
478,"00:38:28,090 --> 00:38:30,240","They're not kids, they're gremlins!","00:38:28,090","00:38:30,240",2308.09,2310.24,2.149999999999636
479,"00:38:30,370 --> 00:38:31,280",Gremlins?!,"00:38:30,370","00:38:31,280",2310.37,2311.28,0.9100000000003092
480,"00:38:31,530 --> 00:38:35,125","Little gremlins, please don't be angry!","00:38:31,530","00:38:35,125",2311.53,2315.125,3.5949999999998
481,"00:38:55,130 --> 00:38:57,200","Now, just hold on a minute.","00:38:55,130","00:38:57,200",2335.13,2337.2,2.069999999999709
482,"00:38:57,300 --> 00:38:58,452",I'll treat you right!,"00:38:57,300","00:38:58,452",2337.3,2338.452,1.1520000000000437
483,"00:38:58,472 --> 00:38:59,624",You want a raise?,"00:38:58,472","00:38:59,624",2338.472,2339.624,1.151999999999589
484,"00:38:59,644 --> 00:39:00,796","Come on, give me a break!","00:38:59,644","00:39:00,796",2339.644,2340.796,1.1520000000000437
485,"00:39:00,940 --> 00:39:02,998","Nope, I've had it.","00:39:00,940","00:39:02,998",2340.94,2342.998,2.0579999999999927
486,"00:39:03,018 --> 00:39:05,076",I'm going back home.,"00:39:03,018","00:39:05,076",2343.018,2345.076,2.0579999999999927
487,"00:39:05,096 --> 00:39:07,154",I can't stay in these haunted hills.,"00:39:05,096","00:39:07,154",2345.096,2347.154,2.0579999999999927
488,"00:39:07,290 --> 00:39:10,043","Come on, Suzuki.","00:39:07,290","00:39:10,043",2347.29,2350.043,2.7530000000001564
489,"00:39:10,170 --> 00:39:15,085","I heard Tokyo was a scary place, but this is too much for me.","00:39:10,170","00:39:15,085",2350.17,2355.085,4.914999999999964
490,"00:39:15,210 --> 00:39:17,326",You'd best stop the construction.,"00:39:15,210","00:39:17,326",2355.21,2357.326,2.1159999999999854
491,"00:39:17,450 --> 00:39:22,002","Whether it's gods or devils, somebody or something is really upset about this project.","00:39:17,450","00:39:22,002",2357.45,2362.002,4.552000000000135
492,"00:39:27,810 --> 00:39:30,688",The raccoons cheered.,"00:39:27,810","00:39:30,688",2367.81,2370.688,2.8780000000001564
493,"00:39:30,810 --> 00:39:34,246",That evening's celebrations were especially grand.,"00:39:30,810","00:39:34,246",2370.81,2374.246,3.436000000000149
494,"00:39:34,370 --> 00:39:39,000","Naturally, the guests of honor were the two heroes, Kiyo and Shokichi.","00:39:34,370","00:39:39,000",2374.37,2379,4.630000000000109
495,"00:39:43,530 --> 00:39:49,287","Meanwhile, the workers' quarters were dark and silent.","00:39:43,530","00:39:49,287",2383.53,2389.287,5.756999999999607
496,"00:39:49,410 --> 00:39:51,924",But the next morning...,"00:39:49,410","00:39:51,924",2389.41,2391.924,2.5140000000001237
497,"00:39:53,610 --> 00:39:56,283",It seemed there was an endless supply of humans.,"00:39:53,610","00:39:56,283",2393.61,2396.283,2.6729999999997744
498,"00:39:56,370 --> 00:40:02,159","No matter how many the raccoons scared away, there were always others to take their place.","00:39:56,370","00:40:02,159",2396.37,2402.159,5.789000000000215
499,"00:40:03,130 --> 00:40:07,768",It's rumored among local residents that this may be the work of foxes and raccoons.,"00:40:03,130","00:40:07,768",2403.13,2407.768,4.63799999999992
500,"00:40:09,610 --> 00:40:11,328",That would make things simple enough.,"00:40:09,610","00:40:11,328",2409.61,2411.328,1.7179999999998472
501,"00:40:11,450 --> 00:40:15,443",All we'd have to do is exterminate all the offending animals.,"00:40:11,450","00:40:15,443",2411.45,2415.443,3.993000000000393
502,"00:40:15,850 --> 00:40:18,489",The raccoons monitoring the broadcast were shocked.,"00:40:15,850","00:40:18,489",2415.85,2418.489,2.6390000000001237
503,"00:40:18,570 --> 00:40:23,280",But these incidents are right out of old folk tales.,"00:40:18,570","00:40:23,280",2418.57,2423.28,4.710000000000036
504,"00:40:23,410 --> 00:40:26,482",It's not surprising people think foxes and raccoons are behind it.,"00:40:23,410","00:40:26,482",2423.41,2426.482,3.0720000000001164
505,"00:40:26,610 --> 00:40:30,489",But that's precisely what proves this is all just malicious rumors.,"00:40:26,610","00:40:30,489",2426.61,2430.489,3.8789999999999054
506,"00:40:30,580 --> 00:40:32,198","What do you mean, rumors?!","00:40:30,580","00:40:32,198",2430.58,2432.198,1.6179999999999382
507,"00:40:32,218 --> 00:40:33,836",I saw it with my own eyes!,"00:40:32,218","00:40:33,836",2432.218,2433.836,1.6179999999999382
508,"00:40:33,930 --> 00:40:35,283","Oh, all right.","00:40:33,930","00:40:35,283",2433.93,2435.283,1.3530000000000655
509,"00:40:36,130 --> 00:40:40,408","In that case, we'll issue an extermination order for these pests.","00:40:36,130","00:40:40,408",2436.13,2440.408,4.277999999999793
510,"00:40:40,730 --> 00:40:45,242","As soon as you find any more raccoons playing more tricks, let us know immediately.","00:40:40,730","00:40:45,242",2440.73,2445.242,4.512000000000171
511,"00:40:45,330 --> 00:40:49,289","That is, if you can prove it!","00:40:45,330","00:40:49,289",2445.33,2449.289,3.9590000000002874
512,"00:40:51,050 --> 00:40:55,969",Shokichi was not the only one who wondered whether shape-shifting was enough to drive out the humans.,"00:40:51,050","00:40:55,969",2451.05,2455.969,4.918999999999869
513,"00:40:56,090 --> 00:41:00,049","As you all know, the Edo period was a golden age for raccoons.","00:40:56,090","00:41:00,049",2456.09,2460.049,3.9589999999998327
514,"00:41:00,170 --> 00:41:07,679",Raccoon shape-shifting was a frequent subject for painters and writers.,"00:41:00,170","00:41:07,679",2460.17,2467.679,7.5090000000000146
515,"00:41:08,490 --> 00:41:11,527","But unfortunately, we raccoons were too conspicuous.","00:41:08,490","00:41:11,527",2468.49,2471.527,3.037000000000262
516,"00:41:11,650 --> 00:41:14,289",We aroused the resentment of humans.,"00:41:11,650","00:41:14,289",2471.65,2474.289,2.6390000000001237
517,"00:41:14,410 --> 00:41:22,640","In the modern era, we've been hunted for our pelts, and our fur has been used for paintbrushes and toothbrushes.","00:41:14,410","00:41:22,640",2474.41,2482.64,8.230000000000018
518,"00:41:22,730 --> 00:41:26,689",That's how the humans took revenge for our excesses.,"00:41:22,730","00:41:26,689",2482.73,2486.689,3.9589999999998327
519,"00:41:26,810 --> 00:41:40,644",Don't any of you ever forget: The past few decades have been peaceful for us raccoons only because we've exercised restraint and not used shape-shifting too often.,"00:41:26,810","00:41:40,644",2486.81,2500.644,13.833999999999833
520,"00:41:41,530 --> 00:41:43,486",Our talents are a two-edged sword.,"00:41:41,530","00:41:43,486",2501.53,2503.486,1.9559999999996762
521,"00:41:44,010 --> 00:41:46,649",I want all of you to use this technique with discretion.,"00:41:44,010","00:41:46,649",2504.01,2506.649,2.638999999999669
522,"00:41:46,730 --> 00:41:52,123","Otherwise, we'll invite further retribution from the humans.","00:41:46,730","00:41:52,123",2506.73,2512.123,5.393000000000029
523,"00:41:55,770 --> 00:42:00,241",Oroku's speech dashed cold water on the spirits of the young raccoons.,"00:41:55,770","00:42:00,241",2515.77,2520.241,4.471000000000004
524,"00:42:00,810 --> 00:42:11,608","And now autumn was upon them, the time of year when raccoons need enough food to store ample fat and grow the long, fluffy coats needed for the coming winter.","00:42:00,810","00:42:11,608",2520.81,2531.608,10.79800000000023
525,"00:42:26,530 --> 00:42:33,366",The young raccoons focused their attention and shape-shifting skills on getting food for the winter.,"00:42:26,530","00:42:33,366",2546.53,2553.366,6.835999999999785
526,"00:42:35,450 --> 00:42:41,082","One day, an exhausted raccoon arrived in the Tama Hills.","00:42:35,450","00:42:41,082",2555.45,2561.082,5.632000000000062
527,"00:42:58,090 --> 00:43:00,046","Don't worry, we're raccoons too!","00:42:58,090","00:43:00,046",2578.09,2580.046,1.9559999999996762
528,"00:43:04,490 --> 00:43:05,889",Thank you very much.,"00:43:04,490","00:43:05,889",2584.49,2585.889,1.399000000000342
529,"00:43:07,260 --> 00:43:09,635",You seem completely worn out.,"00:43:07,260","00:43:09,635",2587.26,2589.635,2.375
