id,times,textString,startTime,endTime,fromSeconds,toSeconds,timeLength
699,"00:57:24,810 --> 00:57:27,324","No, deep fried is the tastiest!","00:57:24,810","00:57:27,324",3444.81,3447.324,2.5140000000001237
700,"00:57:27,460 --> 00:57:29,158",Are you sure?,"00:57:27,460","00:57:29,158",3447.46,3449.158,1.6979999999998654
701,"00:57:29,178 --> 00:57:30,876",I think the tempura batter really makes it.,"00:57:29,178","00:57:30,876",3449.178,3450.876,1.6980000000003201
702,"00:57:31,010 --> 00:57:34,320",That crispy deep fried tail!,"00:57:31,010","00:57:34,320",3451.01,3454.32,3.3099999999999454
703,"00:57:36,490 --> 00:57:39,607",What the hell are you talking about!?,"00:57:36,490","00:57:39,607",3456.49,3459.607,3.117000000000189
704,"00:57:39,700 --> 00:57:42,319",What's important is I love mouse tempura!,"00:57:39,700","00:57:42,319",3459.7,3462.319,2.619000000000142
705,"00:57:42,339 --> 00:57:44,958","Yes, I do!","00:57:42,339","00:57:44,958",3462.339,3464.958,2.619000000000142
706,"00:57:45,460 --> 00:57:46,998",See Gonta?,"00:57:45,460","00:57:46,998",3465.46,3466.998,1.538000000000011
707,"00:57:47,018 --> 00:57:48,556",All we can think about is food.,"00:57:47,018","00:57:48,556",3467.018,3468.556,1.538000000000011
708,"00:57:49,970 --> 00:57:53,280",I think we'd better wait for the masters to get here.,"00:57:49,970","00:57:53,280",3469.97,3473.28,3.3100000000004
709,"00:57:55,170 --> 00:57:56,489",My apologies.,"00:57:55,170","00:57:56,489",3475.17,3476.489,1.31899999999996
710,"00:57:56,610 --> 00:58:03,927",I suppose it was too much to expect the young raccoons to stay chaste and not have babies.,"00:57:56,610","00:58:03,927",3476.61,3483.927,7.317000000000007
711,"00:58:04,460 --> 00:58:07,000",No!,"00:58:04,460","00:58:07,000",3484.46,3487,2.5399999999999636
712,"00:58:07,020 --> 00:58:09,560","Instead of fewer raccoons, we need fewer humans!","00:58:07,020","00:58:09,560",3487.02,3489.56,2.5399999999999636
713,"00:58:10,170 --> 00:58:13,879",The places they've infested used to be our homes!,"00:58:10,170","00:58:13,879",3490.17,3493.879,3.7089999999998327
714,"00:58:14,020 --> 00:58:15,180",The humans are the intruders!,"00:58:14,020","00:58:15,180",3494.02,3495.18,1.1599999999998545
715,"00:58:15,200 --> 00:58:16,360",Drive them out!,"00:58:15,200","00:58:16,360",3495.2,3496.36,1.1600000000003092
716,"00:58:16,380 --> 00:58:17,219",The humans are the intruders!,"00:58:16,380","00:58:17,219",3496.38,3497.219,0.8389999999999418
717,"00:58:17,239 --> 00:58:18,078",Drive them out!,"00:58:17,239","00:58:18,078",3497.239,3498.078,0.8389999999999418
718,"00:58:18,530 --> 00:58:19,645",Kill them!,"00:58:18,530","00:58:19,645",3498.53,3499.645,1.1149999999997817
719,"00:58:20,300 --> 00:58:22,135",Drive them out!,"00:58:20,300","00:58:22,135",3500.3,3502.135,1.8350000000000364
720,"00:58:22,155 --> 00:58:23,990",Kill them!,"00:58:22,155","00:58:23,990",3502.155,3503.99,1.8349999999995816
721,"00:58:24,730 --> 00:58:26,129",But at that very moment...,"00:58:24,730","00:58:26,129",3504.73,3506.129,1.3989999999998872
722,"00:58:41,210 --> 00:58:42,438","Hey, taxi!","00:58:41,210","00:58:42,438",3521.21,3522.438,1.2280000000000655
723,"00:59:13,210 --> 00:59:15,087",I'll tell everyone you're here!,"00:59:13,210","00:59:15,087",3553.21,3555.087,1.8769999999999527
724,"00:59:26,410 --> 00:59:27,445",Tamasaburo!,"00:59:26,410","00:59:27,445",3566.41,3567.445,1.0350000000003092
725,"00:59:27,570 --> 00:59:29,879",I've brought the masters from Shikoku!,"00:59:27,570","00:59:29,879",3567.57,3569.879,2.3089999999997417
726,"00:59:33,340 --> 00:59:34,235",Tamasaburo!,"00:59:33,340","00:59:34,235",3573.34,3574.235,0.8949999999999818
727,"00:59:34,255 --> 00:59:35,150",You did it!,"00:59:34,255","00:59:35,150",3574.255,3575.15,0.8949999999999818
728,"00:59:44,130 --> 00:59:50,046","Friends, on our way here we saw your devastated woods.","00:59:44,130","00:59:50,046",3584.13,3590.046,5.915999999999713
729,"00:59:50,170 --> 00:59:51,649",You have our deepest sympathy.,"00:59:50,170","00:59:51,649",3590.17,3591.649,1.4789999999998145
730,"00:59:51,780 --> 00:59:54,359",We'd like to address all raccoons tonight.,"00:59:51,780","00:59:54,359",3591.78,3594.359,2.5789999999997235
731,"00:59:54,379 --> 00:59:56,958",There's no time to lose.,"00:59:54,379","00:59:56,958",3594.379,3596.958,2.5790000000001783
732,"00:59:57,770 --> 00:59:59,806","Pompoko 33, autumn.","00:59:57,770","00:59:59,806",3597.77,3599.806,2.036000000000058
733,"00:59:59,930 --> 01:00:04,401",All the raccoons assembled to welcome the three masters from Shikoku.,"00:59:59,930","01:00:04,401",3599.93,3604.401,4.471000000000004
734,"01:00:06,210 --> 01:00:10,249",There's a good moon out tonight.,"01:00:06,210","01:00:10,249",3606.21,3610.249,4.03899999999976
735,"01:00:10,370 --> 01:00:15,285","Fellow raccoons, I am Tazaburo Hage of Yashima.","01:00:10,370","01:00:15,285",3610.37,3615.285,4.914999999999964
736,"01:00:15,410 --> 01:00:20,359",I am 999 years old.,"01:00:15,410","01:00:20,359",3615.41,3620.359,4.949000000000069
737,"01:00:21,770 --> 01:00:28,084","Why is Honshu ravaged by development, while Shikoku is almost untouched?","01:00:21,770","01:00:28,084",3621.77,3628.084,6.313999999999851
738,"01:00:28,210 --> 01:00:33,568","The reason is, we raccoons protect our woods vigilantly.","01:00:28,210","01:00:33,568",3628.21,3633.568,5.358000000000175
739,"01:00:33,690 --> 01:00:43,285",The humans of Shikoku know that disaster will befall them if they anger us.,"01:00:33,690","01:00:43,285",3633.69,3643.285,9.5949999999998
740,"01:00:43,410 --> 01:00:52,243","In fact, all three of us are worshipped at every shrine and temple in Shikoku.","01:00:43,410","01:00:52,243",3643.41,3652.243,8.833000000000084
741,"01:00:52,370 --> 01:00:54,930",The humans revere us.,"01:00:52,370","01:00:54,930",3652.37,3654.93,2.5599999999999454
742,"01:00:56,250 --> 01:00:58,206",But I have not introduced myself.,"01:00:56,250","01:00:58,206",3656.25,3658.206,1.956000000000131
743,"01:00:58,330 --> 01:01:04,849","I am Inugami Gyobu, supreme leader of the raccoons of Matsuyama.","01:00:58,330","01:01:04,849",3658.33,3664.849,6.519000000000233
744,"01:01:07,770 --> 01:01:12,605","I am Kincho VI, direct descendant of the first raccoon master of Kincho Shrine.","01:01:07,770","01:01:12,605",3667.77,3672.605,4.835000000000036
745,"01:01:12,730 --> 01:01:20,406","To frighten the humans of Tokyo and drive them out, we have resolved to carry out Operation Goblin.","01:01:12,730","01:01:20,406",3672.73,3680.406,7.675999999999931
746,"01:01:21,090 --> 01:01:31,847","This operation will require unprecedented powers of mental concentration, concentration so great that the three of us may lose our lives.","01:01:21,090","01:01:31,847",3681.09,3691.847,10.757000000000062
747,"01:01:33,490 --> 01:01:46,366","But if you successfully carry out this plan, you will regain the humans' fear and their respect without fail.","01:01:33,490","01:01:46,366",3693.49,3706.366,12.876000000000204
748,"01:01:48,490 --> 01:01:58,159","And then, you can use the humans' fear and respect of raccoons to put an end to this infernal construction once and for all!","01:01:48,490","01:01:58,159",3708.49,3718.159,9.669000000000324
749,"01:01:58,250 --> 01:02:01,208",We have a full array of potent tricks.,"01:01:58,250","01:02:01,208",3718.25,3721.208,2.9580000000000837
750,"01:02:01,330 --> 01:02:08,645","We have brought you a boat, oh raccoons, that will ferry all of you back to a lost era of greatness!","01:02:01,330","01:02:08,645",3721.33,3728.645,7.315000000000055
751,"01:02:08,770 --> 01:02:13,446",We promise you: All who come aboard will reach those blessed shores without fail!,"01:02:08,770","01:02:13,446",3728.77,3733.446,4.675999999999931
752,"01:02:31,650 --> 01:02:35,120",What a beautiful moon.,"01:02:31,650","01:02:35,120",3751.65,3755.12,3.4699999999998
753,"01:02:35,250 --> 01:02:38,048",We raccoons love moonlit nights.,"01:02:35,250","01:02:38,048",3755.25,3758.048,2.7979999999997744
754,"01:02:38,530 --> 01:02:44,526",Let us pray to the moon for the success of our enterprise.,"01:02:38,530","01:02:44,526",3758.53,3764.526,5.99599999999964
755,"01:02:44,650 --> 01:02:47,164","Right, everybody?","01:02:44,650","01:02:47,164",3764.65,3767.164,2.5140000000001237
756,"01:02:58,810 --> 01:03:04,009",The raccoons immediately embarked on a special regimen of training.,"01:02:58,810","01:03:04,009",3778.81,3784.009,5.199000000000069
757,"01:03:18,610 --> 01:03:24,958",Congratulations on your nine hundred and ninety-ninth birthday!,"01:03:18,610","01:03:24,958",3798.61,3804.958,6.347999999999956
758,"01:03:26,980 --> 01:03:29,179",Thank you everyone!,"01:03:26,980","01:03:29,179",3806.98,3809.179,2.199000000000069
759,"01:03:29,199 --> 01:03:31,398",Thank you!,"01:03:29,199","01:03:31,398",3809.199,3811.398,2.199000000000069
760,"01:03:31,810 --> 01:03:36,839","Master, please reenact the story of Yoichi the Archer, as you witnessed it in your younger days!","01:03:31,810","01:03:36,839",3811.81,3816.839,5.028999999999996
761,"01:03:36,970 --> 01:03:39,086",So I shall!,"01:03:36,970","01:03:39,086",3816.97,3819.086,2.1159999999999854
762,"01:04:23,210 --> 01:04:25,678",The time is ripe!,"01:04:23,210","01:04:25,678",3863.21,3865.678,2.467999999999847
763,"01:04:32,770 --> 01:04:35,159",Cock-a-doodle-doo!,"01:04:32,770","01:04:35,159",3872.77,3875.159,2.3890000000001237
764,"01:04:39,650 --> 01:04:41,606","Pom Poko 33, December.","01:04:39,650","01:04:41,606",3879.65,3881.606,1.956000000000131
765,"01:04:41,730 --> 01:04:44,802",The day for Operation Goblin arrived at last.,"01:04:41,730","01:04:44,802",3881.73,3884.802,3.0720000000001164
766,"01:04:45,500 --> 01:04:47,659","Slightly cloudy, no wind.","01:04:45,500","01:04:47,659",3885.5,3887.659,2.1590000000001055
767,"01:04:47,679 --> 01:04:49,838","Thirteen degrees centigrade, humidity 65% .","01:04:47,679","01:04:49,838",3887.679,3889.838,2.1590000000001055
768,"01:04:49,970 --> 01:04:52,006",Perfect conditions for goblins.,"01:04:49,970","01:04:52,006",3889.97,3892.006,2.036000000000058
769,"01:05:26,650 --> 01:05:31,724",Transformation into monsters and goblins has always been a raccoon strong point.,"01:05:26,650","01:05:31,724",3926.65,3931.724,5.074000000000069
770,"01:05:31,850 --> 01:05:43,770","But now, they needed to draw not only on their own latent energy, but also the hidden energy of the cosmos: Fire, earth, water and air.","01:05:31,850","01:05:43,770",3931.85,3943.77,11.920000000000073
771,"01:05:43,850 --> 01:05:56,843",The intensity of the training undertaken by the raccoons under the tutelage of the three elders of Shikoku is almost beyond description.,"01:05:43,850","01:05:56,843",3943.85,3956.843,12.992999999999938
772,"01:05:56,970 --> 01:06:03,687","All the raccoons, even those who could not shape shift, worked together to focus their combined power.","01:05:56,970","01:06:03,687",3956.97,3963.687,6.717000000000098
773,"01:06:06,250 --> 01:06:11,086","That night, the fighting spirit of the raccoons merged into one consuming flame.","01:06:06,250","01:06:11,086",3966.25,3971.086,4.835999999999785
774,"01:06:11,210 --> 01:06:15,610","Their enthusiasm was so boundless, they transformed themselves into goblins long before they even reached the dwellings of the humans.","01:06:11,210","01:06:15,610",3971.21,3975.61,4.400000000000091
775,"01:06:15,610 --> 01:06:18,124",Long before they even reached the dwellings of the humans.,"01:06:15,610","01:06:18,124",3975.61,3978.124,2.513999999999669
776,"01:06:22,450 --> 01:06:24,042","Hey, look at that!","01:06:22,450","01:06:24,042",3982.45,3984.042,1.5920000000000982
777,"01:06:28,730 --> 01:06:30,607",What is it?,"01:06:28,730","01:06:30,607",3988.73,3990.607,1.8769999999999527
778,"01:06:34,490 --> 01:06:38,688",Let the trees burst into full flower!,"01:06:34,490","01:06:38,688",3994.49,3998.688,4.19800000000032
779,"01:06:44,690 --> 01:06:49,480",Let the trees burst into full flower!,"01:06:44,690","01:06:49,480",4004.69,4009.48,4.789999999999964
780,"01:09:07,050 --> 01:09:09,962",Wow... it's a big parade of goblins!,"01:09:07,050","01:09:09,962",4147.05,4149.962,2.912000000000262
781,"01:09:10,090 --> 01:09:14,163","I used to see stuff like that too, way back when.","01:09:10,090","01:09:14,163",4150.09,4154.163,4.072999999999411
782,"01:09:14,250 --> 01:09:17,640","You know, foxes with lanterns, that kind of thing.","01:09:14,250","01:09:17,640",4154.25,4157.64,3.3900000000003274
783,"01:09:17,770 --> 01:09:21,365",You can really see them.,"01:09:17,770","01:09:21,365",4157.77,4161.365,3.594999999999345
784,"01:09:21,490 --> 01:09:24,084",You can see the lanterns.,"01:09:21,490","01:09:24,084",4161.49,4164.084,2.594000000000051
785,"01:09:24,210 --> 01:09:26,485",With little lights in them.,"01:09:24,210","01:09:26,485",4164.21,4166.485,2.274999999999636
786,"01:09:26,610 --> 01:09:30,922",You can see them marching along.,"01:09:26,610","01:09:30,922",4166.61,4170.922,4.311999999999898
787,"01:09:36,370 --> 01:09:40,079",I wonder why I could see them?,"01:09:36,370","01:09:40,079",4176.37,4180.079,3.7089999999998327
788,"01:09:40,210 --> 01:09:43,008",Maybe foxes can really do that.,"01:09:40,210","01:09:43,008",4180.21,4183.008,2.7979999999997744
789,"01:09:43,130 --> 01:09:45,644",I wonder.,"01:09:43,130","01:09:45,644",4183.13,4185.644,2.5140000000001237
790,"01:09:49,210 --> 01:09:51,770",You can really see them.,"01:09:49,210","01:09:51,770",4189.21,4191.77,2.5600000000004
791,"01:09:51,890 --> 01:09:56,406",It must be your brain playing tricks on you.,"01:09:51,890","01:09:56,406",4191.89,4196.406,4.515999999999622
792,"01:09:56,500 --> 01:09:58,372",A fox wedding.,"01:09:56,500","01:09:58,372",4196.5,4198.372,1.8720000000002983
793,"01:09:58,392 --> 01:10:00,264",Foxes with lanterns.,"01:09:58,392","01:10:00,264",4198.392,4200.264,1.8720000000002983
794,"01:10:00,284 --> 01:10:02,156",It's already in your head.,"01:10:00,284","01:10:02,156",4200.284,4202.156,1.8720000000002983
795,"01:10:02,290 --> 01:10:05,839","So, it's like...","01:10:02,290","01:10:05,839",4202.29,4205.839,3.548999999999978
796,"01:10:05,970 --> 01:10:08,643",Your brain plays tricks on you.,"01:10:05,970","01:10:08,643",4205.97,4208.643,2.6729999999997744
797,"01:10:08,780 --> 01:10:11,115",You can see them walking.,"01:10:08,780","01:10:11,115",4208.78,4211.115,2.3350000000000364
798,"01:10:11,135 --> 01:10:13,470",It's all in your head.,"01:10:11,135","01:10:13,470",4211.135,4213.47,2.3350000000000364
799,"01:10:16,260 --> 01:10:18,674","Yeah, you're right.","01:10:16,260","01:10:18,674",4216.26,4218.674,2.41399999999976
800,"01:10:18,694 --> 01:10:21,108",There's no way it's real.,"01:10:18,694","01:10:21,108",4218.694,4221.108,2.41399999999976
801,"01:10:21,250 --> 01:10:25,004",People's brains are scary.,"01:10:21,250","01:10:25,004",4221.25,4225.004,3.7539999999999054
802,"01:10:25,090 --> 01:10:28,969","You think things, and then you see them.","01:10:25,090","01:10:28,969",4225.09,4228.969,3.8789999999999054
803,"01:10:29,090 --> 01:10:32,048","There's no way they could be real, though.","01:10:29,090","01:10:32,048",4229.09,4232.048,2.957999999999629
804,"01:10:34,930 --> 01:10:37,046",They really are real!,"01:10:34,930","01:10:37,046",4234.93,4237.046,2.1159999999999854
805,"01:10:38,690 --> 01:10:41,682",It's just your brain playing tricks on you.,"01:10:38,690","01:10:41,682",4238.69,4241.682,2.992000000000189
806,"01:10:46,490 --> 01:10:47,843",Welcome home.,"01:10:46,490","01:10:47,843",4246.49,4247.843,1.3530000000000655
807,"01:10:50,050 --> 01:10:51,278",Sachiko!,"01:10:50,050","01:10:51,278",4250.05,4251.278,1.2280000000000655
808,"01:11:37,010 --> 01:11:39,399",Matter is void!,"01:11:37,010","01:11:39,399",4297.01,4299.399,2.3890000000001237
809,"01:11:47,530 --> 01:11:49,964",Form is emptiness!,"01:11:47,530","01:11:49,964",4307.53,4309.964,2.4340000000001965
810,"01:12:23,170 --> 01:12:24,398",Here they come again!,"01:12:23,170","01:12:24,398",4343.17,4344.398,1.2280000000000655
811,"01:13:02,090 --> 01:13:03,079",Master Gyobu!,"01:13:02,090","01:13:03,079",4382.09,4383.079,0.988999999999578
812,"01:13:03,860 --> 01:13:04,995",- Master Gyobu!,"01:13:03,860","01:13:04,995",4383.86,4384.995,1.1350000000002183
813,"01:13:05,015 --> 01:13:06,150",- Master Gyobu!,"01:13:05,015","01:13:06,150",4385.015,4386.15,1.1349999999993088
814,"01:13:13,730 --> 01:13:15,448",That was amazing!,"01:13:13,730","01:13:15,448",4393.73,4395.448,1.7180000000007567
815,"01:13:15,570 --> 01:13:16,844","That was scary, wasn't it?","01:13:15,570","01:13:16,844",4395.57,4396.844,1.274000000000342
816,"01:13:18,890 --> 01:13:22,007","Aw, is that the end?","01:13:18,890","01:13:22,007",4398.89,4402.007,3.1169999999992797
817,"01:13:22,140 --> 01:13:23,599",- That was really cool!,"01:13:22,140","01:13:23,599",4402.14,4403.599,1.4589999999998327
818,"01:13:23,619 --> 01:13:25,078",- Yes.,"01:13:23,619","01:13:25,078",4403.619,4405.078,1.4590000000007421
819,"01:13:25,210 --> 01:13:27,804","Come on, time for bed.","01:13:25,210","01:13:27,804",4405.21,4407.804,2.594000000000051
820,"01:13:27,930 --> 01:13:29,522","Oh, OK...","01:13:27,930","01:13:29,522",4407.93,4409.522,1.5919999999996435
821,"01:13:32,010 --> 01:13:34,729",Don't forget to brush your teeth!,"01:13:32,010","01:13:34,729",4412.01,4414.729,2.719000000000051
822,"01:13:37,850 --> 01:13:40,523",I feel like I just woke up from a dream.,"01:13:37,850","01:13:40,523",4417.85,4420.523,2.6729999999997744
823,"01:13:40,620 --> 01:13:42,199",Me too.,"01:13:40,620","01:13:42,199",4420.62,4422.199,1.5789999999997235
824,"01:13:42,219 --> 01:13:43,798","What was all that about, I wonder?","01:13:42,219","01:13:43,798",4422.219,4423.798,1.5789999999997235
825,"01:13:44,650 --> 01:13:47,483","After that, flying saucers would seem pretty tame.","01:13:44,650","01:13:47,483",4424.65,4427.483,2.8330000000005384
826,"01:13:47,970 --> 01:13:50,325",There are some things you just can't explain.,"01:13:47,970","01:13:50,325",4427.97,4430.325,2.3549999999995634
827,"01:13:54,370 --> 01:14:00,282","Long ago, when the Matsuyama clan was at war, Gyobu went over to the enemy, causing the downfall of his clan.","01:13:54,370","01:14:00,282",4434.37,4440.282,5.912000000000262
828,"01:14:00,410 --> 01:14:10,688",He regretted this so deeply that he made a solemn vow to devote the rest of his life fighting for justice.,"01:14:00,410","01:14:10,688",4440.41,4450.688,10.278000000000247
829,"01:14:10,810 --> 01:14:21,323","We must ensure his sacrifice was not in vain, emulate his noble spirit, and vow not to rest until the day of victory!","01:14:10,810","01:14:21,323",4450.81,4461.323,10.51299999999992
830,"01:14:21,410 --> 01:14:34,446",Gyahte gyahte hara gyahte A raccoon of Potamochi Mountain Got drunk and transformed himself!,"01:14:21,410","01:14:34,446",4461.41,4474.446,13.036000000000058
831,"01:14:34,570 --> 01:14:38,119",Great success to Operation Goblin!,"01:14:34,570","01:14:38,119",4474.57,4478.119,3.548999999999978
832,"01:14:38,210 --> 01:14:44,128","The raccoons were so convinced of victory, no one was checking the television for news.","01:14:38,210","01:14:44,128",4478.21,4484.128,5.917999999999665
833,"01:14:44,450 --> 01:14:49,523",Police and the media are searching for anyone who might have videotaped tonight's mysterious parade.,"01:14:44,450","01:14:49,523",4484.45,4489.523,5.07300000000032
834,"01:14:49,610 --> 01:14:55,122","But so far no one has come forward, complicating efforts to determine what really happened.","01:14:49,610","01:14:55,122",4489.61,4495.122,5.512000000000626
835,"01:14:55,250 --> 01:14:59,721","I'm sure I was taping the whole thing, but there's nothing on the tape.","01:14:55,250","01:14:59,721",4495.25,4499.721,4.470999999999549
836,"01:14:59,810 --> 01:15:01,562",It doesn't make any sense.,"01:14:59,810","01:15:01,562",4499.81,4501.562,1.751999999999498
837,"01:15:01,690 --> 01:15:05,888",The goblin slipped in right through this opening.,"01:15:01,690","01:15:05,888",4501.69,4505.888,4.19800000000032
838,"01:15:06,020 --> 01:15:08,196",It was terrifying!,"01:15:06,020","01:15:08,196",4506.02,4508.196,2.175999999999476
839,"01:15:08,216 --> 01:15:10,392",Nobody could have staged that.,"01:15:08,216","01:15:10,392",4508.216,4510.392,2.175999999999476
840,"01:15:11,450 --> 01:15:14,886",There really is something strange about New Town after all.,"01:15:11,450","01:15:14,886",4511.45,4514.886,3.436000000000604
841,"01:15:15,010 --> 01:15:17,763","I'd like to move out, but it's not easy.","01:15:15,010","01:15:17,763",4515.01,4517.763,2.7529999999997017
842,"01:15:17,890 --> 01:15:20,120",There will be a special program at 12:20 a.m.,"01:15:17,890","01:15:20,120",4517.89,4520.12,2.2299999999995634
843,"01:15:20,250 --> 01:15:24,402",With in-depth coverage of this evening's strange events.,"01:15:20,250","01:15:24,402",4520.25,4524.402,4.152000000000044
844,"01:15:34,850 --> 01:15:46,006","The more people investigate this, the more they will be convinced it was no hallucination, that it all really happened!","01:15:34,850","01:15:46,006",4534.85,4546.006,11.155999999999949
845,"01:15:46,130 --> 01:15:54,159","Then, when they realize their science and logic are powerless to unlock the riddle of what happened...","01:15:46,130","01:15:54,159",4546.13,4554.159,8.028999999999542
846,"01:15:54,290 --> 01:16:05,087","They'll be dumbfounded by the awesome mystery of the cosmos, and realize how insignificant human existence really is.","01:15:54,290","01:16:05,087",4554.29,4565.087,10.79700000000048
847,"01:16:05,210 --> 01:16:10,000","Listen, everyone: Our good fortune awaits, but let's not wait for it!","01:16:05,210","01:16:10,000",4565.21,4570,4.789999999999964
848,"01:16:10,130 --> 01:16:12,405",Come then!,"01:16:10,130","01:16:12,405",4570.13,4572.405,2.274999999999636
849,"01:16:12,500 --> 01:16:14,213",Drink!,"01:16:12,500","01:16:14,213",4572.5,4574.213,1.712999999999738
850,"01:16:14,233 --> 01:16:15,946",Sing!,"01:16:14,233","01:16:15,946",4574.233,4575.946,1.712999999999738
851,"01:16:15,966 --> 01:16:17,679",Dance!,"01:16:15,966","01:16:17,679",4575.966,4577.679,1.712999999999738
852,"01:16:17,770 --> 01:16:21,968",Let's hear it for Master Hage!,"01:16:17,770","01:16:21,968",4577.77,4581.968,4.197999999999411
853,"01:16:23,170 --> 01:16:28,563","But the next day, events took a totally unexpected turn.","01:16:23,170","01:16:28,563",4583.17,4588.563,5.393000000000029
854,"01:16:29,490 --> 01:16:38,486","It appears that the massive parade staged yesterday in a residential complex of Tama New Town may have been a publicity stunt for Wonderland, a theme park now under construction in the area.","01:16:29,490","01:16:38,486",4589.49,4598.486,8.996000000000095
855,"01:16:38,610 --> 01:16:44,244","Police have summoned PR executives of Wonderland for questioning, on suspicion of having staged a parade without a permit.","01:16:38,610","01:16:44,244",4598.61,4604.244,5.6340000000000146
856,"01:16:44,370 --> 01:16:45,405",You gotta be kidding!,"01:16:44,370","01:16:45,405",4604.37,4605.405,1.0349999999998545
857,"01:16:45,530 --> 01:16:52,128","However, residents of the complex and the surrounding area remain convinced that what they saw yesterday could not have been a publicity stunt.","01:16:45,530","01:16:52,128",4605.53,4612.128,6.597999999999956
858,"01:16:52,250 --> 01:16:53,842",You can say that again!,"01:16:52,250","01:16:53,842",4612.25,4613.842,1.5919999999996435
859,"01:16:54,210 --> 01:16:59,128",The president of the company responsible for Wonderland has admitted that the parade was a promotional event.,"01:16:54,210","01:16:59,128",4614.21,4619.128,4.917999999999665
860,"01:16:59,250 --> 01:17:00,569",What?,"01:16:59,250","01:17:00,569",4619.25,4620.569,1.3190000000004147
861,"01:17:00,690 --> 01:17:09,725",President of Wonderland At Emergency Press Conference I deeply apologize for any inconvenience caused by our parade yesterday.,"01:17:00,690","01:17:09,725",4620.69,4629.725,9.035000000000764
862,"01:17:10,050 --> 01:17:11,085",Who the hell is he?,"01:17:10,050","01:17:11,085",4630.05,4631.085,1.0349999999998545
863,"01:17:11,210 --> 01:17:21,603","We just wanted the world to know how wonderful, ah, Wonderland will be.","01:17:11,210","01:17:21,603",4631.21,4641.603,10.393000000000029
864,"01:17:21,730 --> 01:17:28,846","So we decided the best way was to go out and give the public a free taste of the, ah, wonders they will soon be able to experience at Wonderland.","01:17:21,730","01:17:28,846",4641.73,4648.846,7.1159999999999854
865,"01:17:28,930 --> 01:17:37,208","As president of Wonderland, I take full responsibility for the staging of this unauthorized event.","01:17:28,930","01:17:37,208",4648.93,4657.208,8.277999999999338
866,"01:17:37,940 --> 01:17:38,716",- What a liar!,"01:17:37,940","01:17:38,716",4657.94,4658.716,0.7760000000007494
867,"01:17:38,736 --> 01:17:39,512",- That's ridiculous!,"01:17:38,736","01:17:39,512",4658.736,4659.512,0.7759999999998399
868,"01:17:39,650 --> 01:17:49,203","Fortunately, we received an overwhelmingly positive response to our parade.","01:17:39,650","01:17:49,203",4659.65,4669.203,9.553000000000793
869,"01:17:49,290 --> 01:17:55,047","Frankly, we were astonished at the enthusiasm we encountered.","01:17:49,290","01:17:55,047",4669.29,4675.047,5.756999999999607
870,"01:17:55,170 --> 01:18:04,564","If this humble servant of the theme park going public has to go to jail, the positive reaction we received will make it all worthwhile.","01:17:55,170","01:18:04,564",4675.17,4684.564,9.394000000000233
871,"01:18:06,180 --> 01:18:06,840",- What in the world?!,"01:18:06,180","01:18:06,840",4686.18,4686.84,0.6599999999998545
872,"01:18:06,860 --> 01:18:07,520",- Is this for real?,"01:18:06,860","01:18:07,520",4686.86,4687.52,0.660000000000764
